<!ELEMENT students (student)+>
<!ELEMENT student (first_name, last_name, email?, grades?)>
<!ELEMENT first_name (#PCDATA)>
<!ELEMENT last_name (#PCDATA)>
<!ELEMENT email (#PCDATA)>
<!ELEMENT grades (grade*)>
<!ATTLIST grade exercice CDATA #REQUIRED>
<!ELEMENT grade (#PCDATA)>